[
  {"id":"water-valley-01","world":"Water Valley","concept":"integration","engine":"curve","act":"experience","objective":"Fill the lower reservoir before the village gate opens.","tools":["timeController","measurementMarker","riemannApproximation"],"goal":{"type":"accumulate","target":420},"revealNotationAfterCompletion":true},
  {"id":"mountain-racer-01","world":"Mountain Racer","concept":"derivative","engine":"curve","act":"experience","objective":"Find the point where the road is steepest.","tools":["movableProbe","secantTool","tangentTool"],"goal":{"type":"maxSlope","moveLimit":14},"revealNotationAfterCompletion":true},
  {"id":"gradient-expedition-01","world":"Gradient Expedition","concept":"gradient","engine":"field","act":"control","objective":"Reach the summit using the fewest steps.","tools":["altimeter","directionalSlopeProbe","compass"],"goal":{"type":"reachMaximum","moveLimit":14},"revealNotationAfterCompletion":true},
  {"id":"gradient-expedition-02","world":"Gradient Expedition","concept":"partial derivatives","engine":"field","act":"measure","objective":"Compare east-west and north-south height changes at the same point.","tools":["lockedHeading","altimeter","differenceMeter"],"goal":{"type":"comparePartialRates"},"revealNotationAfterCompletion":true},
  {"id":"vector-field-01","world":"Vector Field","concept":"divergence","engine":"field","act":"measure","objective":"Locate the hidden air leak.","tools":["particleTracer","circularSensor"],"goal":{"type":"locateMaxDivergence"},"revealNotationAfterCompletion":true},
  {"id":"vector-field-02","world":"Vector Field","concept":"curl","engine":"field","act":"measure","objective":"Find the strongest whirlpool.","tools":["particleTracer","floatingWheel"],"goal":{"type":"locateMaxCurl"},"revealNotationAfterCompletion":true},
  {"id":"field-sailing-01","world":"Field Sailing","concept":"line integral","engine":"flow","act":"control","objective":"Reach the beacon while harvesting at least 500 energy.","tools":["pathDrawer","energyGauge"],"goal":{"type":"pathEnergy","target":500},"revealNotationAfterCompletion":true},
  {"id":"solar-shield-01","world":"Solar Shield","concept":"surface integral","engine":"flow","act":"control","objective":"Generate 8 MW inside the safe orientation zone.","tools":["panelRotator","fluxGauge"],"goal":{"type":"flux","target":8},"revealNotationAfterCompletion":true},
  {"id":"island-circulation-01","world":"Island Mystery","concept":"Stokes theorem","engine":"flow","act":"generalise","objective":"Infer the broken interior sensor from boundary circulation.","tools":["boundaryRoute","circulationGauge"],"goal":{"type":"stokesInference"},"revealNotationAfterCompletion":true},
  {"id":"ecosystem-01","world":"Living Ecosystem","concept":"differential equations","engine":"dynamic","act":"experience","objective":"Keep rabbits between 200 and 500 for 60 months.","tools":["foodControl","habitatControl","shockControl"],"goal":{"type":"stabilisePopulation","target":60},"revealNotationAfterCompletion":true},
  {"id":"spring-bridge-01","world":"Spring Bridge","concept":"second-order differential equations","engine":"dynamic","act":"control","objective":"Settle the bridge in under 4 seconds without overshooting 5%.","tools":["massControl","stiffnessControl","dampingControl"],"goal":{"type":"settleOscillation","target":4},"revealNotationAfterCompletion":true},
  {"id":"chaos-observatory-01","world":"Chaos Observatory","concept":"chaotic dynamics","engine":"dynamic","act":"experience","objective":"Discover how a tiny parameter change reshapes the long-term orbit.","tools":["growthDial","orbitRecorder","sensitivityMeter"],"goal":{"type":"compareTrajectories"},"revealNotationAfterCompletion":true},
  {"id":"sound-observatory-01","world":"Sound Observatory","concept":"Fourier transform","engine":"signal","act":"measure","objective":"Remove machine noise while preserving the bird call.","tools":["frequencyCrystals","spectrumMeter"],"goal":{"type":"filterSignal"},"revealNotationAfterCompletion":true},
  {"id":"crystal-chamber-01","world":"Crystal Chamber","concept":"matrix transformations","engine":"transformation","act":"control","objective":"Transform the blue symbol so it fits the doorway.","tools":["rotationCrystal","stretchCrystal","shearCrystal"],"goal":{"type":"matchShape"},"revealNotationAfterCompletion":true},
  {"id":"eigen-sanctum-01","world":"Eigen Sanctum","concept":"eigenvectors","engine":"transformation","act":"experience","objective":"Find the direction that survives the transformation.","tools":["arrowProbes","growthMeter"],"goal":{"type":"findInvariantDirection"},"revealNotationAfterCompletion":true},
  {"id":"area-chamber-01","world":"Area Chamber","concept":"determinant","engine":"transformation","act":"measure","objective":"Measure how the transformation scales a unit square.","tools":["unitSquare","areaGauge"],"goal":{"type":"measureAreaScale"},"revealNotationAfterCompletion":true},
  {"id":"teleport-gate-01","world":"Teleport Gate","concept":"Jacobian","engine":"transformation","act":"generalise","objective":"Calibrate the gate so a local reference grid aligns.","tools":["zoomLens","localGrid","alignmentKnobs"],"goal":{"type":"localLinearise"},"revealNotationAfterCompletion":true},
  {"id":"complex-plane-01","world":"Complex Plane","concept":"complex numbers","engine":"plane","act":"experience","objective":"Reach the crystal gate using multiplication portals.","tools":["scalePortal","rotationPortal","complexCompass"],"goal":{"type":"reachGate"},"revealNotationAfterCompletion":true},
  {"id":"complex-boss-01","world":"Complex Plane","concept":"Euler formula","engine":"plane","act":"name","objective":"Match circular motion to its sine and cosine projections.","tools":["angleDial","projectionMeter"],"goal":{"type":"matchWave"},"revealNotationAfterCompletion":true},
  {"id":"network-garden-01","world":"Network Garden","concept":"graph paths","engine":"graph","act":"control","objective":"Connect the village gates using the shortest safe route.","tools":["vertexPicker","edgeToggler","pathMeter"],"goal":{"type":"shortestPath","target":7},"revealNotationAfterCompletion":true},
  {"id":"chance-casino-01","world":"Chance Casino","concept":"probability simulation","engine":"probability","act":"measure","objective":"Estimate the hidden bias from repeated draws.","tools":["trialCounter","outcomeSampler","confidenceGauge"],"goal":{"type":"estimateProbability","target":0.6},"revealNotationAfterCompletion":true},
  {"id":"geometry-workshop-01","world":"Geometry Workshop","concept":"geometry construction","engine":"geometry","act":"experience","objective":"Build a stable triangular bridge with the required area.","tools":["vertexHandles","angleGauge","areaMeter"],"goal":{"type":"matchArea","target":6},"revealNotationAfterCompletion":true}
]
